{
  "$schema": "./catalog.schema.json",
  "version": "1.0.0",
  "generated_by": "scripts/catalog-generator.py",
  "regions": {
    "stage": {
      "kind": "stage",
      "skills": [
        {
          "path": ".claude/skills/stage-01-requirement-analysis.skill.md",
          "name": "stage-01-requirement-analysis",
          "description": "需求分析阶段：多Agent爬取资料 + 产品技能需求调研 + 产出需求分析文档",
          "version": "",
          "commands": [
            "/stage-01",
            "/需求分析阶段"
          ],
          "downstream": [
            {
              "name": "requirement-analyzer",
              "department": "产品",
              "path": "产品/skill/requirement-analyzer.skill.md"
            },
            {
              "name": "user-story-generator",
              "department": "产品",
              "path": "产品/skill/user-story-generator.skill.md"
            },
            {
              "name": "acceptance-criteria-writer",
              "department": "产品",
              "path": "产品/skill/acceptance-criteria-writer.skill.md"
            }
          ]
        },
        {
          "path": ".claude/skills/stage-02-requirement-development.skill.md",
          "name": "stage-02-requirement-development",
          "description": "需求开发阶段：理解需求 + 产出功能点清单 + BRD文档",
          "version": "",
          "commands": [
            "/stage-02",
            "/需求开发阶段"
          ],
          "downstream": [
            {
              "name": "user-story-generator",
              "department": "产品",
              "path": "产品/skill/user-story-generator.skill.md"
            },
            {
              "name": "acceptance-criteria-writer",
              "department": "产品",
              "path": "产品/skill/acceptance-criteria-writer.skill.md"
            },
            {
              "name": "business-rule-analyzer",
              "department": "产品",
              "path": "产品/skill/business-rule-analyzer.skill.md"
            }
          ]
        },
        {
          "path": ".claude/skills/stage-03-requirement-understanding.skill.md",
          "name": "stage-03-requirement-understanding",
          "description": "需求理解阶段：生成原型图、业务流程图、功能点详细描述文档（按模块/子模块/功能点分类组织）",
          "version": "",
          "commands": [
            "/stage-03",
            "/需求理解阶段"
          ],
          "downstream": [
            {
              "name": "user-story-generator",
              "department": "产品",
              "path": "产品/skill/user-story-generator.skill.md"
            },
            {
              "name": "acceptance-criteria-writer",
              "department": "产品",
              "path": "产品/skill/acceptance-criteria-writer.skill.md"
            }
          ]
        },
        {
          "path": ".claude/skills/stage-04-system-design.skill.md",
          "name": "stage-04-system-design",
          "description": "系统设计阶段：生成系统需求、性能指标、容量规划文档",
          "version": "",
          "commands": [
            "/stage-04",
            "/系统设计阶段"
          ],
          "downstream": [
            {
              "name": "system-architect",
              "department": "研发",
              "path": "研发/skill/architect/system-architect.skill.md"
            }
          ]
        },
        {
          "path": ".claude/skills/stage-05-outline-design.skill.md",
          "name": "stage-05-outline-design",
          "description": "概要设计阶段：生成业务架构设计、数据库设计",
          "version": "",
          "commands": [
            "/stage-05",
            "/概要设计阶段"
          ],
          "downstream": [
            {
              "name": "system-architect",
              "department": "研发",
              "path": "研发/skill/architect/system-architect.skill.md"
            },
            {
              "name": "db-designer-java",
              "department": "研发",
              "path": "研发/skill/design/db-designer-java.skill.md"
            },
            {
              "name": "data-model-designer",
              "department": "研发",
              "path": "研发/skill/design/data-model-designer.skill.md"
            }
          ]
        },
        {
          "path": ".claude/skills/stage-06-module-scheduling.skill.md",
          "name": "stage-06-module-scheduling",
          "description": "模块排期阶段：生成系统实现排期计划（哪个完成哪个先）",
          "version": "",
          "commands": [
            "/stage-06",
            "/模块排期阶段"
          ],
          "downstream": [
            {
              "name": "milestone-tracker",
              "department": "项目管理",
              "path": "项目管理/skill/milestone-tracker.skill.md"
            },
            {
              "name": "schedule-planner",
              "department": "项目管理",
              "path": "项目管理/skill/schedule-planner.skill.md"
            }
          ]
        },
        {
          "path": ".claude/skills/stage-07-backend-development.skill.md",
          "name": "stage-07-backend-development",
          "description": "后端开发阶段：同步文档 + 调用框架skill开发 + 检查错误 + 生成前端对接文档",
          "version": "",
          "commands": [
            "/stage-07",
            "/后端开发阶段"
          ],
          "downstream": [
            {
              "name": "entity-designer-java",
              "department": "研发",
              "path": "研发/skill/design/entity-designer-java.skill.md"
            },
            {
              "name": "db-designer-java",
              "department": "研发",
              "path": "研发/skill/design/db-designer-java.skill.md"
            },
            {
              "name": "api-designer-java",
              "department": "研发",
              "path": "研发/skill/design/api-designer-java.skill.md"
            },
            {
              "name": "code-review",
              "department": "研发",
              "path": "研发/skill/process/code-review.skill.md"
            }
          ]
        },
        {
          "path": ".claude/skills/stage-08-frontend-development.skill.md",
          "name": "stage-08-frontend-development",
          "description": "前端开发阶段：同步文档 + 调用框架skill开发 + 检查错误",
          "version": "",
          "commands": [
            "/stage-08",
            "/前端开发阶段"
          ],
          "downstream": [
            {
              "name": "vue-implement",
              "department": "研发",
              "path": "研发/skill/implement/vue-implement.skill.md"
            },
            {
              "name": "vue-best-practices",
              "department": "研发",
              "path": "研发/skill/design/vue-best-practices.skill.md"
            },
            {
              "name": "component-designer-vue",
              "department": "研发",
              "path": "研发/skill/design/component-designer-vue.skill.md"
            }
          ]
        }
      ]
    },
    "agent_model": {
      "kind": "role_skill",
      "skills": [
        {
          "path": "1.0-软件开发流程角色agent模型/产品/skill/acceptance-criteria-writer.skill.md",
          "name": "acceptance-criteria-writer",
          "description": "",
          "version": "",
          "department_zh": "产品",
          "department_id": "product"
        },
        {
          "path": "1.0-软件开发流程角色agent模型/产品/skill/business-rule-analyzer.skill.md",
          "name": "business-rule-analyzer",
          "description": "",
          "version": "",
          "department_zh": "产品",
          "department_id": "product"
        },
        {
          "path": "1.0-软件开发流程角色agent模型/产品/skill/requirement-analyzer.skill.md",
          "name": "requirement-analyzer",
          "description": "",
          "version": "",
          "department_zh": "产品",
          "department_id": "product"
        },
        {
          "path": "1.0-软件开发流程角色agent模型/产品/skill/requirement-researcher.skill.md",
          "name": "requirement-researcher",
          "description": "",
          "version": "",
          "department_zh": "产品",
          "department_id": "product"
        },
        {
          "path": "1.0-软件开发流程角色agent模型/产品/skill/user-manual-writer.skill.md",
          "name": "user-manual-writer",
          "description": "",
          "version": "",
          "department_zh": "产品",
          "department_id": "product"
        },
        {
          "path": "1.0-软件开发流程角色agent模型/产品/skill/user-story-generator.skill.md",
          "name": "user-story-generator",
          "description": "",
          "version": "",
          "department_zh": "产品",
          "department_id": "product"
        },
        {
          "path": "1.0-软件开发流程角色agent模型/安全/skill/security-code-review.skill.md",
          "name": "security-code-review",
          "description": "",
          "version": "",
          "department_zh": "安全",
          "department_id": "security"
        },
        {
          "path": "1.0-软件开发流程角色agent模型/安全/skill/security-review.skill.md",
          "name": "security-review",
          "description": "Use this skill when adding authentication, handling user input, working with secrets, creating API endpoints, or implementing payment/sensitive features. Provides comprehensive security checklist and patterns.",
          "version": "",
          "department_zh": "安全",
          "department_id": "security"
        },
        {
          "path": "1.0-软件开发流程角色agent模型/安全/skill/security-scan.skill.md",
          "name": "security-scan",
          "description": "",
          "version": "",
          "department_zh": "安全",
          "department_id": "security"
        },
        {
          "path": "1.0-软件开发流程角色agent模型/安全/skill/security-threat-model.skill.md",
          "name": "security-threat-model",
          "description": "",
          "version": "",
          "department_zh": "安全",
          "department_id": "security"
        },
        {
          "path": "1.0-软件开发流程角色agent模型/数据/skill/data-lineage-trace.skill.md",
          "name": "data-lineage-trace",
          "description": "",
          "version": "",
          "department_zh": "数据",
          "department_id": "data"
        },
        {
          "path": "1.0-软件开发流程角色agent模型/数据/skill/data-quality-check.skill.md",